[
  {
    "id": "archaeology",
    "name": "Archaeology",
    "tier": "trained",
    "bonus": 10,
    "description": "Ancient cultures and artifacts.",
    "prerequisites": [],
    "source": {
      "book": "Player's Survival Guide",
      "system": "mothership-1e",
      "version": "1.2",
      "page": 22,
      "section": "22.2"
    }
  },
  {
    "id": "art",
    "name": "Art",
    "tier": "trained",
    "bonus": 10,
    "description": "The expression or application of a species' creative ability and imagination.",
    "prerequisites": [],
    "source": {
      "book": "Player's Survival Guide",
      "system": "mothership-1e",
      "version": "1.2",
      "page": 22,
      "section": "22.2"
    }
  },
  {
    "id": "athletics",
    "name": "Athletics",
    "tier": "trained",
    "bonus": 10,
    "description": "Physical fitness, sports, and games.",
    "prerequisites": [],
    "source": {
      "book": "Player's Survival Guide",
      "system": "mothership-1e",
      "version": "1.2",
      "page": 22,
      "section": "22.2"
    }
  },
  {
    "id": "botany",
    "name": "Botany",
    "tier": "trained",
    "bonus": 10,
    "description": "The study of plant life.",
    "prerequisites": [],
    "source": {
      "book": "Player's Survival Guide",
      "system": "mothership-1e",
      "version": "1.2",
      "page": 22,
      "section": "22.2"
    }
  },
  {
    "id": "chemistry",
    "name": "Chemistry",
    "tier": "trained",
    "bonus": 10,
    "description": "The study of matter and its chemical elements and compounds.",
    "prerequisites": [],
    "source": {
      "book": "Player's Survival Guide",
      "system": "mothership-1e",
      "version": "1.2",
      "page": 22,
      "section": "22.2"
    }
  },
  {
    "id": "computers",
    "name": "Computers",
    "tier": "trained",
    "bonus": 10,
    "description": "Fluent use of computers and their networks.",
    "prerequisites": [],
    "source": {
      "book": "Player's Survival Guide",
      "system": "mothership-1e",
      "version": "1.2",
      "page": 22,
      "section": "22.2"
    }
  },
  {
    "id": "geology",
    "name": "Geology",
    "tier": "trained",
    "bonus": 10,
    "description": "The study of the solid features of any terrestrial planet or its satellites.",
    "prerequisites": [],
    "source": {
      "book": "Player's Survival Guide",
      "system": "mothership-1e",
      "version": "1.2",
      "page": 22,
      "section": "22.2"
    }
  },
  {
    "id": "industrial-equipment",
    "name": "Industrial Equipment",
    "tier": "trained",
    "bonus": 10,
    "description": "The safe and proper use of heavy machinery and tools (exosuits, forklifts, drills, breakers, laser cutters, etc.).",
    "prerequisites": [],
    "source": {
      "book": "Player's Survival Guide",
      "system": "mothership-1e",
      "version": "1.2",
      "page": 22,
      "section": "22.2"
    }
  },
  {
    "id": "jury-rigging",
    "name": "Jury-Rigging",
    "tier": "trained",
    "bonus": 10,
    "description": "Makeshift repair, using only the tools and materials at hand.",
    "prerequisites": [],
    "source": {
      "book": "Player's Survival Guide",
      "system": "mothership-1e",
      "version": "1.2",
      "page": 22,
      "section": "22.2"
    }
  },
  {
    "id": "linguistics",
    "name": "Linguistics",
    "tier": "trained",
    "bonus": 10,
    "description": "The study of languages (alive, dead, and undiscovered).",
    "prerequisites": [],
    "source": {
      "book": "Player's Survival Guide",
      "system": "mothership-1e",
      "version": "1.2",
      "page": 22,
      "section": "22.2"
    }
  },
  {
    "id": "mathematics",
    "name": "Mathematics",
    "tier": "trained",
    "bonus": 10,
    "description": "The study of numbers, quantity, and space.",
    "prerequisites": [],
    "source": {
      "book": "Player's Survival Guide",
      "system": "mothership-1e",
      "version": "1.2",
      "page": 22,
      "section": "22.2"
    }
  },
  {
    "id": "military-training",
    "name": "Military Training",
    "tier": "trained",
    "bonus": 10,
    "description": "Basic training provided to all military personnel.",
    "prerequisites": [],
    "source": {
      "book": "Player's Survival Guide",
      "system": "mothership-1e",
      "version": "1.2",
      "page": 22,
      "section": "22.2"
    }
  },
  {
    "id": "rimwise",
    "name": "Rimwise",
    "tier": "trained",
    "bonus": 10,
    "description": "Practical knowledge and know-how regarding outer Rim colonies, their customs, and the seedier parts of the galaxy.",
    "prerequisites": [],
    "source": {
      "book": "Player's Survival Guide",
      "system": "mothership-1e",
      "version": "1.2",
      "page": 22,
      "section": "22.2"
    }
  },
  {
    "id": "theology",
    "name": "Theology",
    "tier": "trained",
    "bonus": 10,
    "description": "The study of the divine or devotion to a religion.",
    "prerequisites": [],
    "source": {
      "book": "Player's Survival Guide",
      "system": "mothership-1e",
      "version": "1.2",
      "page": 22,
      "section": "22.2"
    }
  },
  {
    "id": "zero-g",
    "name": "Zero-G",
    "tier": "trained",
    "bonus": 10,
    "description": "Practice and know-how of working in a vacuum, orientation, vaccsuit operation, etc.",
    "prerequisites": [],
    "source": {
      "book": "Player's Survival Guide",
      "system": "mothership-1e",
      "version": "1.2",
      "page": 22,
      "section": "22.2"
    }
  },
  {
    "id": "zoology",
    "name": "Zoology",
    "tier": "trained",
    "bonus": 10,
    "description": "The study of animal life.",
    "prerequisites": [],
    "source": {
      "book": "Player's Survival Guide",
      "system": "mothership-1e",
      "version": "1.2",
      "page": 22,
      "section": "22.2"
    }
  },
  {
    "id": "asteroid-mining",
    "name": "Asteroid Mining",
    "tier": "expert",
    "bonus": 15,
    "description": "Training in the tools and procedures used for mining asteroids.",
    "prerequisites": [
      "geology",
      "industrial-equipment"
    ],
    "source": {
      "book": "Player's Survival Guide",
      "system": "mothership-1e",
      "version": "1.2",
      "page": 23,
      "section": "23.1"
    },
    "prerequisiteSource": "reviewed"
  },
  {
    "id": "ecology",
    "name": "Ecology",
    "tier": "expert",
    "bonus": 15,
    "description": "The study of organisms and how they relate to their environment.",
    "prerequisites": [
      "botany",
      "geology"
    ],
    "source": {
      "book": "Player's Survival Guide",
      "system": "mothership-1e",
      "version": "1.2",
      "page": 23,
      "section": "23.1"
    },
    "prerequisiteSource": "reviewed"
  },
  {
    "id": "explosives",
    "name": "Explosives",
    "tier": "expert",
    "bonus": 15,
    "description": "Design and effective use of explosive devices (bombs, grenades, shells, land mines, etc.).",
    "prerequisites": [
      "chemistry",
      "jury-rigging",
      "military-training"
    ],
    "source": {
      "book": "Player's Survival Guide",
      "system": "mothership-1e",
      "version": "1.2",
      "page": 23,
      "section": "23.1"
    },
    "prerequisiteSource": "traced"
  },
  {
    "id": "field-medicine",
    "name": "Field Medicine",
    "tier": "expert",
    "bonus": 15,
    "description": "Emergency medical care and treatment.",
    "prerequisites": [
      "zoology"
    ],
    "source": {
      "book": "Player's Survival Guide",
      "system": "mothership-1e",
      "version": "1.2",
      "page": 23,
      "section": "23.1"
    },
    "prerequisiteSource": "reviewed"
  },
  {
    "id": "firearms",
    "name": "Firearms",
    "tier": "expert",
    "bonus": 15,
    "description": "Safe and effective use of guns.",
    "prerequisites": [
      "military-training",
      "rimwise"
    ],
    "source": {
      "book": "Player's Survival Guide",
      "system": "mothership-1e",
      "version": "1.2",
      "page": 23,
      "section": "23.1"
    },
    "prerequisiteSource": "reviewed"
  },
  {
    "id": "hacking",
    "name": "Hacking",
    "tier": "expert",
    "bonus": 15,
    "description": "Unauthorized access to computer systems and networks.",
    "prerequisites": [
      "computers"
    ],
    "source": {
      "book": "Player's Survival Guide",
      "system": "mothership-1e",
      "version": "1.2",
      "page": 23,
      "section": "23.1"
    },
    "prerequisiteSource": "traced"
  },
  {
    "id": "hand-to-hand-combat",
    "name": "Hand-to-Hand Combat",
    "tier": "expert",
    "bonus": 15,
    "description": "Melee fighting, brawling, martial arts, etc.",
    "prerequisites": [
      "athletics",
      "military-training",
      "rimwise"
    ],
    "source": {
      "book": "Player's Survival Guide",
      "system": "mothership-1e",
      "version": "1.2",
      "page": 23,
      "section": "23.1"
    },
    "prerequisiteSource": "reviewed"
  },
  {
    "id": "mechanical-repair",
    "name": "Mechanical Repair",
    "tier": "expert",
    "bonus": 15,
    "description": "Fixing broken machines.",
    "prerequisites": [
      "industrial-equipment",
      "jury-rigging"
    ],
    "source": {
      "book": "Player's Survival Guide",
      "system": "mothership-1e",
      "version": "1.2",
      "page": 23,
      "section": "23.1"
    },
    "prerequisiteSource": "reviewed"
  },
  {
    "id": "mysticism",
    "name": "Mysticism",
    "tier": "expert",
    "bonus": 15,
    "description": "Spiritual apprehension of hidden knowledge.",
    "prerequisites": [
      "archaeology",
      "art"
    ],
    "source": {
      "book": "Player's Survival Guide",
      "system": "mothership-1e",
      "version": "1.2",
      "page": 23,
      "section": "23.1"
    },
    "prerequisiteSource": "traced"
  },
  {
    "id": "pathology",
    "name": "Pathology",
    "tier": "expert",
    "bonus": 15,